text	labels
in a letter to economic affairs minister , the listed estonian shipping company tallink asks for the approval to be entitled to a 15 % cut in port fees in 2010 .	1
finnish power company fortum reports 89 % of its electricity was generated without carbon dioxide emissions in 2007 .	1
honkarakenne s customer in this project is one of the biggest real estate companies in kazakhstan , according to the company .	1
the contracts have been signed to acquire uranium produced at the sotkamo nickel-zinc mine in eastern finland owned by talvivaara .	2
rapala vmc corporation rapala , a leading fishing tackle and sporting goods manufacturer and distributor , is the main owner of peltonen with its 80 % shareholding .	1
the plant will go on stream in november 2008 and its estimated daily production will be 120,000 litres of bioethanol .	1
finnish financial software developer basware oyj said today it will provide its invoice automation ia solution to an unnamed major retail company in the usa in a deal , worth more than eur300 ,000 .	2
consolidated net sales increased 16 % to reach eur74 .8 m , while operating profit amounted to eur0 .9 m compared to a loss of eur0 .7 m in the prior year period .	2
finnish fibre-based materials maker ahlstrom corp hel : ahl1v said today it decided to close down its spunlace composite production line number 23 at chirnside plant in the uk by the end of march 2011 .	1
fortum holds 90.2 pct of the share capital and 94.4 pct of the voting rights in the company , which it now plans to delist from the warsaw stock exchange .	1
the business idea of budget sport is to offer customers a wide range of high-quality sports equipment and clothing at low prices , the company said .	1
as capacity was cut with 1.4 % , the passenger load factor was down 7.8 percentage points .	0
alexandria , va. , oct. 23 -- hans-otto scheck of espoo , finland , has developed a method of identifying remote radio units in a communication system .	1
alexandria , va. , may 23 -- matti harkonen and pentti sipponen , both of espoo , finland , osmo suovaniemi of helsinki , finland , and tapani tiusanen of vantaa , finland , have developed a paper web press device .	1
remote phone management demonstrates sysopen digia s unique end-to-end offering for operators , handset manufacturers and enterprise customers .	1
in the third quarter of 2010 , net sales increased by 5.2 % to eur 205.5 mn , and operating profit by 34.9 % to eur 23.5 mn .	2
the liquidity providing was interrupted on may 11 , 2007 when aspocomp group oyj s shares traded below 0.50 cent aspocomp s stock exchange release 11.5.2007 .	0
at 12.01 pm , the omx helsinki 25 was down 0.66 pct to 3,143.57 and the omx helsinki was 0.67 pct lower at 10,530.74 on 253 mln eur turnover .	0
the sale of the healthcare trade business supports oriola-kd s strategy to focus on pharmaceutical wholesale and retail businesses .	2
the fair value change of investment properties was eur 15.8 mn , compared to eur 22.9 mn in the third quarter of 2009 .	0
kalnapilio-tauro grupe kalnapilis-tauras group , which is owned by denmark s royal unibrew , raised its market share to 25.2 percent from 23.91 percent , as beer sales for the nine months jumped by 11.4 percent to 52.99 million liters .	2
the acquisition of boomeranger boats oy is in line with the done solutions strategy of developing its business through company acquisitions .	2
the outsourcing agreement , which covers equipment and depots in turku and tampere , will run for five years , cramo said on thursday .	1
neste oil extended yesterday s gains and put on 0.49 pct to 22.72 eur , while utility fortum shed 1.14 pct to 20.76 eur .	1
the contract was signed in august with papua new guinea-based lihir gold ltd asx : lgl .	2
 the new agreement is a continuation to theagreement signed earlier this year with the lemminkainen group , whereby cramo acquired the entire construction machine fleet oflemminkainen talo oy ita - ja pohjois suomo , and signed asimilar agreement , said tatu hauhio , managing director ofcramo finland .	1
neste oil said that while results from its biomass to 3 liquids demonstration plant , commissioned in june 2009 , have been promising , no decision on a commercial plant has been taken .	1
the company , employing 6,400 , reported net sales of 620 mln euro $ 823.2 mln for 2006 .	1
most of the growth in beer consumption took place in the far east , latin america and africa .	1
the one dark spot on the horizon , however , was the company s performance in the finnish bottled water market .	0
 this is super nasty , said eric schultze , chief technology officer at shavlik technologies llc , a st. paul , minn.-based maker of patch management tools .	0
of the price , kesko s share is 10 mln euro $ 15.5 mln and it will recognize a gain of 4.0 mln euro $ 6.2 mln on the disposal which will be included in the result for the second quarter of 2008 .	2
as part of the reorganisation , pohjola insurance s 250 field staff for private customers will join the payroll of local cooperative banks from the beginning of october 2008 .	1
tip of the week panfish like bluegills are great fun to catch , especially for children new to fishing .	1
nokia has inaugurated its manufacturing plant near chennai on 11 mar 2006 .	1
the airline was targeting travel agents , tour operators and travel management companies to raise awareness first before targeting consumers , he added .	1
reporting in accordance with the merged business operations will start as of january 1 , 2011 .	1
for teleste , the acquisition marks an entry into services business in a market where it has long been an established and significant supplier of products .	2
estonia s beer market overall grew three percent last year to 130 million liters .	2
we also strengthen our existing partnership with cybercom , says teleste cto esko myllyla .	2
most of the layoffs will be in finland .	0
today , we are connecting people in new and different ways - fusing advanced mobile technology with personalized services to enable people to stay close to what matters to them .	1
the company estimates that the trend in demand for sports equipment will be steady in 2006 , amer s report said .	2
the commission is to be applauded for applying a fact-based and data-driven approach and for providing clarity for future petitions .	2
according to statistics by the finnish maritime administration , shipping did not increase much in january-august 2009 , however .	1
last week , however , nokia announced that it will pursue a long-term relationship with microsoft , and make the windows phone 7 operating system the foundation for nokia mobile phones .	1
altogether finnair has canceled over 500 flights because of the strike .	0
according to the company s updated strategy for the years 2009-2012 , basware targets a long-term net sales growth in the range of 20 % -40 % with an operating profit margin of 10 % -20 % of net sales .	2
scanfil will execute the temporary lay-offs by mid-october 2009 and the job cuts by march 2010 .	0
 residentialconstruction in particular has picked up in several markets .	2
one of the installed elevators will be a double-deck elevator , which enables more efficient use of the building s core space .	2
finnish diversified holding company aspo oyj said on september 8 , 2008 that it will sell the finnish tape business of its kaukomarkkinat unit to local oy telpak ab .	1
automation makes it possible to conduct several tests simultaneously .	1
the court s decision will also promote genuine competition in services	1
in the beginning of the negotiations , the estimated number of reductions was 50 at the maximum .	1
srv will raise its holding in the company so that by the summer of 2008 , it will have a majority .	2
when new types of network elements are added to the network , the conversion file is updated by adding the information required for converting the message format of the new network element type to the format understood by the management system .	1
the sale , comprising the margarine business in finland and poland , follows the approval of the polish competition authorities earlier in october .	1
on the other hand , finnish sawmills production has decreased even more .	0
by implementing the software the finnish army aims to unify and improve its operations in these application areas , qpr software stated .	2
the opportunity will be available only for few employees , however .	1
fi is developing cooperation in keyword advertising with microsoft .	2
the port operator , however , favors retaining the port fees in 2010 , citing the owner , the governemtn of estonia , commiting the port to pay eek 400mn eur 25.56 mn usd 36.44 mn in dividends to the state in 2009 and another eek 300mn in 2010 .	1
the transaction will take place without payment of merger consideration .	1
fortum also has a blocking stake in northwestern tgk-1 .	1
these share transactions are part of the company s strategy of relinquishing assets that are not part of its core business .	1
 the flex is a small price to pay for happy lenders . 	1
 we have become convinced that we can do that very quickly , he told finnish business reporters .	1
lemcon has also signed a pre-contract for the purchase of the park s entire 130-hectare site .	2
the companies signed the letter of intent for the sale on 17 september 2010 and envisaged to seal the actual agreement on 1 january 2011 .	1
in accordance with our strategy , we strengthened our local presence by establishing a representative office in south africa in october .	2
espoon kaupunki awarded contracts for personal care products .	2
the contract comprises a log handling line , a peeling line , and a veneer drying and grading line .	1
the company s previous estimate was for a lower revenue than the year-ago eur 93.9 million .	0
the terms of the financing were approved by the annual general meeting of the company held on june 30 , 2010 .	2
it grew in finland , norway , denmark and the baltic countries .	1
to raise consumer awareness and encourage people to recycle their old mobile devices nokia runs regular recycling campaigns around the world .	1
nordic walking was first used as a summer training method by cross-country skiers .	1
at the end of march 2007 , the group s order book was at eur 39.6 mn , up 42 % from the corresponding period in 2006 .	2
technopolis is europe s leading operator of technoparks .	2
the increase range will vary up to 10 % .	1
the company will use the money for product development and research activities through 2013 in its key markets finland , germany , italy and france .	1
 small well targeted acquisitions have played an important role in executing satama s strategy in the past couple of years .	1
rushydro has an agreement to transfer its stakes in oesk and the five ercs into the trust management of inter rao .	1
geosentric oyj s geosolutions business unit gypsii , the mobile digital lifestyle application and geo-mobility social networking platform , has signed an agreement with nanjing mynet to make the gypsii mobile social networking platform available to customers of china mobile .	2
the resignation will be in effect immediately .	1
cargo traffic fell 1 % year-on-year to 8,561 tonnes in september 2009 .	0
the world of glass is coming to egypt and we invite visitors from all around the world to attend glass world exhibition 2009 , register now at url 	1
finnish communication electronics components supplier scanfil oyj tuesday said sales in the first half of 2006 will be 15 % lower than during the same period a year ago .	0
helsingin uutiset , vantaan sanomat and lansivayla reach some 385,000 readers , or more than 40 % of the consumers in the greater helsinki region .	2
the company s objective is to offer the best people flow experience by developing and delivering solutions that enable people to move smoothly , safely , comfortably and without waiting in buildings in an increasingly urbanizing environment .	1
fiskars has a strong portfolio of international brands , which include fiskars , iittala , gerber , silva and buster .	2
net sales in 2007 totalled eur 329 million and the operating margin was above 19 % .	1
helsinki afx - kesko corp is expected to report a lower second quarter eps today due to tax charges , but other earnings lines are seen higher year-on-year , analysts said .	0
capacity will ease at its seikku sawmill in pori and alholma sawmill in pietarsaari and result in 60 people being laid off for around six weeks starting mid-may , it said .	0
divisional sales demand in the half remained inconsistent , it added .	0
the ipad application joins the iphone app as part of monster s range of mobile applications for job hunting .	1
the parties have also agreed on options that allow uh to extensively implement later on also functionalities of human resources management .	2
as a result of these negotiations the company has decided to make 45 people redundant on financial and production grounds .	0
viking line has canceled some services .	0
the company said production volumes so far indicate the circuit is capable of the targeted output rate of 60,000 tonnes per day , or 22 million tonnes a year .	1
most of the increase in net sales was due to the acquisition of swedish silva that produces garden tools and boats .	2
the maritime administration said the ships had ignored warnings about the icy conditions .	0
alexandria , va. , march 28 -- pertti salmi and hanna vuolteenaho , both of oulu , finland , and sami viitasaari of ii , finland , have developed an ornamental design for a handset , the u.s. patent trademark office announced .	1
in finland , export industry forms a large clientele for the packaging industry .	1
mr. atul chopra , chief operating officer president , tecnotree elaborated i am eager to see the continued success of the former tecnomen , bringing lifetree product to mena , under the tecnotree umbrella .	1
marketing will use tikkurila s existing infra structure and local knowledge in russia .	1
latin america currently accounts for approximately 40 % of sales at tecnotree , company president and ceo eero mertano recently told bnamericas .	1
we aim to ensure that vacon is in good shape when capital expenditure starts to pick up again , comments vacon plc president and ceo vesa laisi .	2
growth was strongest in f-secure s operator isps , mobile operators and cable operators business .	2
alexandria , va. , nov. 5 -- risto kontturi of rajamaki , finland , and jari ylinen of hyvinkaa , finland , have developed an automated transportation system with a user-controlled transport selection .	1
also construction expenses have gone up in russia .	0
stuk today is a full service house expert in radiation and nuclear safety issues .	1
in addition to the indian market , the new plant will serve salcomp s customers globally , the company said .	2
clothing chain sepp nl n s net sales increased by 7.0 % to eur 30.8 mn .	2
earnings per share eps for the first quarter 2007 amounted to eur0 .07 , up from eur0 .04 .	2
shareholders have a right to put on the agenda of the agm items that are within the competence of the general meeting .	1
in january-november 2009 , the group s sales totalled eur 7,801.7 mn , which was a drop of 12.6 % from the same period of 2008 .	0
the total value of the agreement is usd4 .0 m , the company said .	1
 uncommonly weak snow conditions in nearly every market have affected our first quarter result , chief executive roger talermo said .	0
fortum is now considering taking part in nuclear energy projects outside of finland .	1
the company said that its investments in the new market areas resulted in sales increase in sweden , poland , russia and lithuania .	2
apart from nordea , also ergo is competing for the position among the top three pension funds providers in estonia .	1
 leipurin is a growing and rapidly internationalizing group .	2
operating profit was eur 139.7 mn , up 23 % from eur 113.8 mn .	2
the pulp production in finnish kemij nrvi will also be liquidated and about 1,100 employees loose their jobs .	0
finnish cargotec has been awarded a significant order for a total of 292 hiab loader cranes by bae systems in the us .	2
 adpnews - dec 1 , 2009 - finnish cutlery and hand tools maker fiskars oyj abp hel : fisas said today that it will make redundant a total of 18 office and management staff members of its subsidiary iittala group ltd. .	0
vdw combined with lxe devices enhances productivity , enabling workers to use a single device to perform voice , scanning and keyboard functions .	2
mr priit kasak , balti metsamasina s owner , said the rakvere-based company wishes to increase valmet s market share from 27 % to a third in a couple of years .	2
the company closed last year with a turnover of about four million euros .	1
both sources said nokia would unveil its new phone code-named tube on oct. 2 at an analyst and media event in london .	1
the amendment will not incur additional costs .	1
via the takeover , panostaja further expands its business area specialising in digital printing , which since previously consists of the subsidiaries kopijyva oy and sokonet oy .	2
the nokian tyre proves its high safety excellently in the important driving qualities stability with mark 1.4 , handling 1.5 and braking on wet road with 1.9 .	2
lifetree was founded in 2000 , and its revenues have risen on an average by 40 % with margins in late 30s .	2
finnish electrical components maker salcomp oyj hel : sal1v announced today the launch of its latest twist charger platform .	1
the lay-offs will affect 240 people out of the total 320 okmetic employees in finland .	0
the new policy was also aimed at making the companies more profitable and competitive .	2
stora enso oyj , the largest papermaker , in october said it would close four mills .	0
some 250 people , of whom more than 200 are workers , will be retiring from the raahe works between 2008 and 2011 .	1
industry investment is very interested in glaston s solar energy projects .	2
in 2007 , marimekko has also opened concept stores in yokohama and nagoya , central japan , in silver spring in metropolitan washington dc , usa , in graz , central austria , and in aalborg , northern denmark .	2
sales rose to 300.9 mln eur compared with last year s 276.1 mln eur and in line with 299 mln eur consensus figure .	2
 filippova a trilateral agreement on investment in the construction of a technology park in st petersburg was to have been signed in the course of the forum , days of the russian economy , that opened in helsinki today .	2
the group also plans to launch the 270 room atria grand , whitefield , a five star luxury hotel , in 2009 .	1
 lidskoe pivo s investment program foresees the integrated modernization of production , updating transport and logistics infrastructure and developing new marketing instruments , mikshis said .	2
steve jackson , ebusiness analyst at satama and former ceo of aboavista said : google broke the mold when they gave away google analytics for free .	1
furthermore , bunge will also sign a licensing agreement for the sunnuntai and carlshamn mejeri brands .	2
 with this new version it is very important for us to introduce a bim process that is based on the detailed building information model .	1
this beauty is an updated version of her chichi loop shade launched in 2001 .	1
exports make up more than 80 per cent of our sales , so the name glaston also reflects a truly internationally operating company , explains kyro s president ceo mika seitovirta .	1
finnish metso will supply new wood handling and bleaching lines , as well as a rebuild of the kraft liner washing line for klabin s tel maco borba mill in the brazilian state of paran i .	2
finnish forest machinery manufacturer ponsse has issued a profit warning .	0
when the situation normalises , the company will be able to increase the amount of residential units for sale in st petersburg and moscow , in particular .	2
finnish industrial group ruukki group plc omx helsinki : rug1v said on friday 14 november that its furniture business segment incap furniture has concluded personnel negotiations that were started at the end of september .	1
 the announced investment of the carmaker hyundai for example sounds optimistically for us as of course new cars mean new tires . 	2
the portfolio comprises of 118,000 m2 of leasable space with a vacancy rate of roughly 5 % , let to around 140 tenants of which two of the largest are the swedish government and ericsson .	1
according to scanfil , demand for telecommunications network products has fluctuated significantly in the third quarter of 2006 , and the situation is expected to remain unstable for the rest of the year .	0
under the agreement , pfizer has been funding biotie s research activities on the pde10 phosphodiesterase 10 inhibitor program since its start in late 2006 and has the sole authority to develop discovered compounds .	1
according to soosalu , particular attention was paid to residents privacy and security in the design of the aleksandri street building .	1
 our approach is very much to only use raw materials that are produced in line with the principles of sustainable development .	1
j nrvi-suomen portti is also planning to reduce the use of sodium nitrite .	1
the cooperation will double the switch s converter capacity .	2
the apartment block will be well-located , in easy reach of the city center and close to both a school and kindergarten .	2
the company said it observed a current stabilisation in prices and there is potential for higher prices for deliveries in the first quarter of 2011 .	2
it is also in the process of taking a seat on capman s board - a course which has the support of capman management .	1
from business line , may 16 , 2008 sriperumbudur , may 15 - nokia s two key suppliers - aspocomp and wintek - are likely to start operations within three months in the nokia telecom park at sriperumbudur , 45 km west off chennai .	1
in the reporting period , the company s operating profit grew by 43.2 % to eur 6 million .	2
according to sepp nnen , the new technology umts900 solution network building costs are by one-third lower than that of the building of 3.5 g networks , operating at 2,100 mhz frequency .	2
the forecast for 2012 is 3.3 % .	1
21 december 2010 - finnish industrial machinery company wartsila oyj abp hel : wrt1v said yesterday it had won an order to design a liquefied natural gas lng powered platform supply vessel psv for norwegian oil service provider eidesvik offshore asa osl : eiof .	2
after the transaction , m-real will own 30 % in metsa-botnia and upm -- 17 % .	1
however short-term rentals are becoming more popular .	1
aug. 31 , 2009 gawker media delivered by newstex -- if you love fishing video games but felt that there just was n t enough wackiness involved , then activision s nasdaq : atvi rapala : we fish might just catch your eye with its family-fun hook .	1
currently , 95 % of trainers house s revenues are attributed to the finnish market .	1
south african sappi will become the largest foreign forest industry company operating in finland as a result of the acquisition finnish m-real corporation s graphic papers business unit .	2
the innova 2 building will be located close to downtown , in the immediate vicinity of paviljonki and the travel center , and within walking distance from the heart of the city thanks to the trade fair bridge .	1
the company s scheduled traffic , measured in revenue passenger kilometres rpk , grew by just over 2 % and nearly 3 % more passengers were carried on scheduled flights than in february 2009 .	2
the subscriptions increase cargotec s share capital by eur 27,060 .	2
he found him again , however , after the driver was involved in a two-car accident .	1
in the financial statement for the first quarter of 2010 , tikkurila is reported under discontinued operations .	1
alma media holds 70 % of this company , the remaining shares being owned by the company s key employees .	1
geneva , feb. 10 -- tero aaltonen , finland has developed a radio resource control method .	1
mr clausen , however , refused to comment the option that nordea would consider buying into citadele bank .	1
an individual promotion also generated slightly higher-than-expected revenues .	2
von koskull will oversee a new unit of nordea , which brings together corporate merchant banking , financial institutions and capital markets products divisions .	1
return on capital employed roce was a negative 2.3 % compared to 11.3 % in 2007 .	0
in the fourth quarter of 2009 , orion s net profit went up by 33.8 % year-on-year to eur33m .	2
alexandria , va. , dec. 17 -- reijo salovaara , nastola , finland , has developed a veneer cutter .	1
approval by shareholders of cencorp in accordance with finnish law .	1
finnlines said that the deal is part of its strategy to focus on its core businesses .	1
according to a report by neomarkka , kuitu finland s customers are interested in buying the company s products when it restarts production .	2
stora enso , a global paper , packaging and wood products company , and neste oil , a finnish company engaged in the refining and marketing of oil , have inaugurated the demonstration plant at varkaus , finland for biomass to liquids production utilizing forestry residues .	1
 social networking and location-based service trends comprise a significant share of the internet traffic today and are appealing to mid users .	1
the device offers multimedia performance along with a host of productivity applications , including live stock prices .	1
in beers , olvi retained its market position .	1
in the automobile space , maruti is the most searched brand in cars .	1
altimo previously agreed a similar deal with telenor to merge their stakes in vimpelcom and kyivstar-gsm .	1
