text	labels
speaking to just-drinks today , a spokesperson for olvi said : we have performed very well in all four countries we operate in - namely , finland , estonia , latvia and lithuania . 	2
we bring a new , committed leadership and business and strategic know-how to the company that we buy .	1
the total investment in the company will be eur58m , of which wartsila s share will be eur29m .	1
the amending of the proposal simplifies the proposed plan and increases the incentive for key employees to stay in the company .	2
following the acquisition , relacom will strengthen its presence in finland , serving operators and office market with mobile and fixed networks construction , installation and maintenance services .	2
stichting pensioenfonds abp : 4 118 122 shares representing 5.19 % of the share capital and voting rights .	1
last year s third quarter result had been burdened by costs stemming from restructuring in the us .	0
he is a member of the board of numerous com-panies and a shareholder of the boardman ltd board specialist net-work .	1
helsinki afx - metso said it will upgrade one of upm-kymmene s four paper machines at the latter s mill in jaemsaenkoski with a new coating color supply system , machine and process controls and quality measurements .	2
the recruitment is related to the relocation of stora enso s research operations to karlstad , central sweden .	1
compared with the ftse 100 index , which rose 94.9 points or 1.6 % on the day , this was a relative price change of -0.4 % .	0
the measures result from weak demand in the shipbuilding industry .	0
the solutions will be used for upgrading the networks of a russian mso in 37 different cities in russia .	2
according to heikkil n , more than just refreshment and energy will soon be found in soft drinks also in finland .	1
alexandria , va. , july 11 -- hannu kahonen of juuka , finland , has developed an ornamental design for a handle for fire pit door , the u.s. patent trademark office announced .	1
to choose basware as the tools for our financial service seemed like a natural continuation of our cooperation , says tommi leskinen , financial applications manager , neste oil corporation .	1
our superior customer centricity and expertise in digital services set us apart from our competitors .	2
the company has established a 3g base station at about 17,000 feet at the foot of mount everest that will enable mountain climbers at the 29,035-foot summit to surf the internet and even send videos of their exploits .	2
some of the lay-offs will be implemented using part-time employment contracts .	1
the company expects to open its first online shop in the us in the summer in 2011 .	1
in the third quarter , net sales increased by 12 % year-on-year to eur159 .5 m , or by 6 % at comparable currency rates growth .	2
the company said that its comparable operating profit for the january-june period fell short of last year s corresponding performance .	0
the largest restructuring is planned for italy , where negotiations on about 40 job cuts are to be initiated today , the company noted .	0
the outsourced scan and capture solutions transfer paper invoices into electronic format , and basware business transactions service allows the customer to receive and send invoices in an electronic format .	1
the transaction covers a building lot of 46,763 sq m and factory buildings of 19,631 sq m. since the autumn of 2007 , when scanfil discontinued its production operations in oulu , the facilities have been partly leased to other parties .	1
currently alfred a palmberg is putting the finishing touches to one of finland s biggest ever re-plumbing and bathroom refurbishment projects also in the district of vuosaari .	1
in addition to its stake in megafon , telecominvest currently owns 100 % of shares in web plus and st. petersburg payphones , 51 % in telecom equipment producer peter-servis and a number of other minor assets .	1
finnish industrial investor panostaja oyj omx helsinki : pnaas omx helsinki : pnabs said on friday 11 july that it has signed a deal to acquire the entire share capital of kospa oy , the manufacturer of waste disposal equipment .	2
rapala estimates its net sales for 2008 will increase by between 8.0 pct and 12 pct assuming 2007 exchange rates .	2
jens schulte-bockum , vodafone s global director of terminals , said the company expects to sell one to two million of the vodafone 125 and 225 models in the first year of launch , and potentially tens of millions over the lifetime of the device .	2
sales in latin america increased by 42 % to eur 432mn , and a total of 8.7 mn mobile devices were sold in the area , representing an increase of 32 % from the corresponding period in 2009 .	2
according to finnish aktia bank s managing director jussi laitinen , the bank s aim is to triple the number of its customers in finland in the next five years .	2
viking line and stx finland said on monday that there were plans to build a 240 million euro ferry that would be launched on the turku-stockholm route in spring 2013 .	1
neomarkka has played a leading role in a group that aims to restart the production of specialty cellulose fiber in valkeakoski .	1
in addition to the demand in finland , the export of lining stone products also increased .	2
the corresponding increase in the share capital due to these subscriptions with the warrants , in total eur 1,860.74 , was registered with the finnish trade register on january 4 , 2008 .	1
as a result of these transactions , the aggregate holdings of burrill life sciences capital fund , l.p. has decreased below 5 per cent of the total number of shares and votes of the company .	0
finnish civil aviation administration decided to temporarily reopen finnish capital s helsinki airport since 3 p.m. to 11 p.m. monday local time .	1
kone s net sales rose by some 14 % year-on-year in the first nine months of 2008 .	2
after the transaction , danske bank becomes an equal player with nordic bank group nordea in the nordic countries .	1
while the company did not indicate the level of investment in the unit , it said that has purchased the equipment of nokia corporation s mobile phone r d laboratory in jyvaeskylae .	1
teliasonera s subsidiary , the mobile operator emt in estonia , has created a world s first mobile identification service which makes it possible to vote via a mobile phone .	1
sysopen digia had signed an agreement with the main shareholders of sentera holding in total 77.39 % of the share capital and votes of sentera .	2
following the increase , huhtamaki oyj s registered share capital is eur 358,706,290.00 and the number of shares outstanding is 105,501,850 .	1
 adp news - nov 28 , 2008 - finnish power-supply solutions provider efore oyj omx : efo1v announced today the launch of opus dc , the latest power system in its opus product line .	2
furthermore , sales of new passenger cars and light commercial vehicles in the country declined by 5.4 % year-on-year last month .	0
ge is building the facility with wind power developer invenergy wind llc .	1
lead production , in turn , should increase to 60,000 tonnes through 2009 in what would be a twofold increase from current capacity levels , zahariev said .	2
repeats sees 2008 ebita above 18 pct of sales .	2
the tekla structures 16 installation has been built according to microsoft s requirements for the windows 7 certification , the company added .	1
tekla s software solutions make customers core processes more effective in building and construction , energy distribution , infrastructure management and water supply .	1
juhani j nrvi , corporate executive vice president of kesko , says the russian food retail sector is fragmented .	1
this pc application allows users to copy files and other data from their nokia mobile device to their computer as well as create backup content .	1
in the fourth quarter of 2008 , net sales increased by 2 % to eur 1,050.7 mn from eur 1,027.0 mn in the fourth quarter of 2007 .	2
finnish suominen corporation that makes wet wipes , nonwovens , and flexible packaging is starting employer-employee negotiations at its tampere plant in finland to lay off about 25 employees .	0
it s even a little bit higher than yara s multiples on itself , an analyst in helsinki said .	1
at the moment , valio is not worried , but if the ban continues for long , it may become quite a problem .	0
the chain is to unite 45-50 centres by the end of 2008 .	1
a profit is still on target .	2
however , the orders received during the period under review fell by 17 % quarter-on-quarter from the eur 213 million recorded in the second quarter of 2010 .	0
 url designed by patricia burt , this is just one of a selection of distinctive hooked rugs created with recycled materials and dyed natural dyes .	1
the vessels are the largest and fastest ropax vessels in the world that will be built by fincantieri .	1
you are warmly welcome 	1
the fund at fair value will increase correspondingly .	2
ixonos estimates that it will hire 20 specialists in mechanical engineering , electronics design , and r d for its new unit in jyvaeskylae by the end of 2009 .	2
the original name componenta am nl , as a subsidiary of the finnish componenta group , has been changed to am nl components and the company has seen a 63 % growth in q1 2010 , in comparison to q1 2009 .	2
russia wants to utilise its huge forest reserves in a very different way from what has been done so far .	1
bioheapleaching makes extraction of metals from low grade ore economically viable .	1
kazgiprotsvetmet and outotec finland have signed an agreement on strategic cooperation in the marketing and providing of minerals processing and metallurgical plants and related services in kazakhstan and the surrounding countries .	2
net sales in 2010 were about eur 2.0 billion , of which international operations accounted for roughly a quarter .	1
as a result , the company has decided it will implement fixed-term temporary lay-offs .	0
adp news - feb 13 , 2009 - finnish retailer kesko oyj hel : kesbv said today its total sales , excluding value added tax vat , stood at eur 661.3 million usd 853.1 m in january 2009 , down 15.2 % year-on-yea	0
 the summer collection 2008 will be joyfully fresh like a vitamin injection , said h m s head of design margareta van den bosch .	1
in 2007 , huhtamaki will continue to invest in organic growth .	1
m-real said there are no grounds for the rumors , which have been circulating in the market for some months . 	1
net profit in the same period in 2006 was x20ac 172 million .	1
together , yahoo and nokia said they will continue to deliver internet experiences that address the core needs of consumers , developers , operators and advertisers .	1
hu will offer a further discount of between 25 % and 50 % on selected books .	1
under the agreement , tietoenator will provide blyk with extended application and business process management services and an it infrastructure .	2
comparable operating profit totaled eur 4.7 mn , down from eur 5.1 mn in the corresponding period in 2005 , representing 7.4 % of net sales .	0
forest certification is a voluntary system aimed at promoting sustainable forest management in commercial forests .	1
the 50-50 joint venture , to be called nokia siemens networks , will be comprised of nokia s network business group and siemens carrier-related operations , creating estimated synergies of 1.5 billion euros $ 1.9 billion by 2010 , nokia said .	2
15 september 2010 - finnish electrical components maker salcomp oyj hel : sal1v announced today the launch of its latest twist charger platform .	1
finnish and swedish construction markets are still experiencing an estimated 4 % annual growth in 2008 .	2
finnair s total traffic decreased by 8.7 % in terms of revenue passenger kilometres .	0
pharmaceuticals - spain this brand-new market analysis gives a clear overview of the actual situation and future outlook of the pharmaceutical market in spain .	1
it said comptel delivers reliable provisioning and activation solutions which improve fulfilment processes for operators .	1
coca-cola was the market leader of manufacturers with a market share of 36.9 % , down 2.2 % from the corresponding period in 2004-2005 .	0
hobby hall s sales decrease 26 pct due to implementing a new information system that involved changing in the principal of posting sales .	0
this is due to the postponement of the decision-making of projects in the negotiation phase from the earlier estimation .	1
after the renovation the biggest moulding line in the orhangazi foundry is the most modern line in europe .	2
an android app will be coming soon .	1
 adp news - jan 27 , 2009 - finnish industrial machinery company vaahto group ltd oyj hel : wat1s said today that its subsidiary vaahto ltd would cut 15 jobs in finland .	0
helsinki-based componenta bought turkish listed company doktas in october 2006 for 89 million euros , making it the largest finnish investment in turkey to date .	1
 we were the lowest bidders and now the final approval is awaited . 	2
the contract also includes cutting and edging wagon parts at ruukki s steel service centres in seinajoki and raahe , from where they will be delivered to vr for welding and assembly .	1
 we respect their decision ... the discussions are now closed , said kai telanne , alma media s ceo .	1
it is also set to launch a messaging service in the next few days , which would enable users to access their e-mail accounts on ms exchange .	1
the insurance division turned a eur120m profit .	1
finnish property investor sponda said it has agreed a 100 mln eur , five-year mln credit facility with swedbank and a 50 mln eur , seven-year facility with oko bank .	1
sales for the department store division increased by 15 % and sales for the clothing store subsidiary seppala increased by 8 % meanwhile sales for hobby hall decreased by 12 % .	2
a total of 131000 talvivaara mining company plc s new shares were subscribed for during the period between may 1 , 2010 and june 30 , 2010 under the company s stock option rights 2007a .	1
last month , outokumpu sold more than 80 percent of its technology unit , outokumpu technology oyj , to further its strategic goal of becoming the world s largest stainless steel maker .	2
airvana s umts home base station femto cell uses software-based functionality and off-the-shelf silicon to accelerate feature development and reduce product cost .	2
in january-september 2010 , fiskars net profit went up by 14 % year-on-year to eur 65.4 million and net sales to eur 525.3 million from eur 487.7 million .	2
panostaja treats its negotiating partners , such as entrepreneurs selling their life s work and newcomer entrepreneurs seeking a career , fairly , justly and according to the law .	1
empresa de desarrollo urbano de quito , innovar-uio , ecuador has commissioned poyry to prepare a feasibility study for a new urban rapid mass transit system .	1
according to the company , its operating profit , excluding non-recurring items , in the fourth quarter of 2009 was significantly better than expected , and also better than the figures for the fourth quarter of 2008 .	2
the fuel purchase contracts have been signed with three months delivery from this september to november .	1
the price for logs has clearly improved from 2009 and also the price of pulpwood has gone up .	2
 i m not sure what s happening .	1
the difference can be explained by the fact that two shipping companies have stopped operating in the gulf of finland .	1
netcom expects to complete turbo 3g deployment in these areas this year .	1
risto jalo , chief executive of dormus print and also owner of the remainder of the company , will keep his position after the acquisition .	1
the swedish maritime administration has closed the furusund channel , which viking line normally charters en route to stockholm .	1
stora enso has also had meetings with the labor authorities , employment and economic development centres and representatives of the government in order to find solutions .	1
luxembourg-registered investment fund amber trust ii has won the final approval of lithuania s competition council to acquire 29.6 percent of sanitas , the country s largest pharmaceutical producer .	2
eurochem cfo andrey ilyin said : this facility marks another important step for eurochem in securing the long-term financing necessary for our potash and other strategic projects .	2
the government started the sell-off last month , putting an 8 percent stake in teliasonera on the auction bloc .	1
about midnighttrader : midnighttrader is the premier source of extended-hours us equity trading analysis , news and forecasting for the retail and institutional investment community .	1
no price was given for the transaction , which merges two london companies that have worked together on a number of projects including delivery of timetables for britain s national express east coast rail networks .	1
jukka hienonen , the current finnair ceo , will step down at the end of january 2010 .	1
earnings per share eps amounted to a loss of eur0 .05 .	0
in addition , lehdentekijat oy will start producing a new membership magazine , viisas raha wise money for the association .	2
it includes options for additional 30 communal building sites as well as construction supervision works for all construction sites .	1
 the sale of the oxygen measurement business strengthens our goal to focus on our chosen market segments .	1
cargo volume grew by 7 % .	2
1 april 2011 - finnish machinery rental company ramirent oyj hel : rmr1v said today it has acquired the assets of sector player stavebni doprava a mechanizace sdm in the czech republic for an undisclosed sum .	1
comptel , a vendor of dynamic operations support system oss software , has been selected by orascom telecom oth as partner for provisioning and activation solutions for mobile services .	2
benefon s target is to lay off temporarily of permanently up to 20 % of the salo plant s staff .	0
hearst will be able to consolidate about 20 % of all russian market for advertising in press after the purchase .	2
the layoffs were aimed at reaching an annual savings target of 1.5 billion euros $ 2 billion by the end of 2010 .	2
in finland , the launch of tie-in sales of 3g mobile phones did not cause a dramatic rush in mobile retail outlets during the first few days .	1
the new facility , to be known as technopolis pulkovo , will introduce to the russian market an entirely new concept of creating , operating and growing a commercially-funded science and technology park to support the growth of knowledge-intensive companies .	1
of the sales price , a sales gain of some 3.1 mln euro $ 4.5 mln will be recognized in incap s earnings for 2007 .	2
the current lay-offs are additional to the temporary lay-offs agreed in december 2008 and in may 2009 .	0
in parallel , teliasonera has decided to conduct a compulsory acquisition .	1
rinkuskiai s beer sales fell by 6.5 per cent to 4.16 million litres , while kauno alus beer sales jumped by 6.9 per cent to 2.48 million litres .	1
 several growth initiatives in the chosen geographic areas are already ongoing , it continued , noting lindex opened its first store in the czech republic this autumn in brno .	2
earnings per share eps in 2005 amounted to a loss of eur1 .26 .	1
the relocation of ragot has already started and will be completed in the next few weeks , with the waterqueen and tortue moves planned for mid-2008 and vmc europe during the third quarter of 2008 .	1
sony ericsson and nokia dominated the list of best-selling handsets with five models each .	2
at the end of last week , protalix biotherapeutics inc amex : plx published a prospectus for a first offering on amex of about 5 % of its share capital .	1
veracel is preparing an appeal in the issue and has asked the court for clarification of the judgement .	1
while i cant understand what theyre saying , its impressive to watch him hit that ball at those speeds .	1
the eb tough voip field phone is equipped with an integrated speaker , ethernet and shdsl connectivity , and enables several innovative applications .	1
it will combine and renew the contents and functionality of the current systems for funding and online service as well as their maintenance .	2
the estimated synergy benefits are at least eur7m annually .	2
 stonesoft sees great promise in the future of ipv6 .	2
 adpnews - dec 30 , 2009 - finnish investment group neomarkka oyj hel : nembv said today that it will furlough employee in its unit reka cables ltd for less than 90 days , starting in january 2010 .	1
basware offers full support for all sap versions starting from sap 4.5 .	1
even so , tulikivi emissions are well below some of the strictest state standards including washington and colorado .	1
the company s annual loss amounted to eek 18mn , compared to a profit of eek 7.3 mn in 2008 .	0
indigo and somoncom serve 377,000 subscribers and had a market share of approximately 27 % as of may 2007 .	1
risto raty , tekla s executive vice president , said that tekla structures and archicad will cover the entire design and documentation workflow throughout a construction project .	1
the personnel s expertise and high level of technology play a major role in exel composites operations .	1
upgrades include a five megapixel camera , voice control , and what looks to be an optical mouse instead a d-pad -- an upgrade click-happy s60 has needed forever .	2
we can choose the most efficient , best overall value option for our customers already at the bidding stage .	2
 pulp and paper industries are growing in countries like china and russia .	1
the aim is to develop open-source application solutions .	1
alfa group will have 43.9 % of voting stock in the new company and telenor 35.4 % with a free float of 20.7 % .	1
asimilar agreement was signed between china mobile ltd. sehk : 0941 and nyse : chl , the largest mobile carrier , and thegps and social networking service provider , promoting gypsii service before beijing 2008 olympic games , according to thelatest news .	2
a broad range of connectivity options including 3g - hspa and wi-fi gives consumers high speed access to the internet .	1
the daily graphic newspaper , in october , reported an initiative being embarked upon by the fidelity bank to partner ghana post , which has offices across the country , to offer financial services to the unbanked and under-banked in the country .	1
the dividend will be paid on april 15 , 2008 to each of the shareholders who on the record date of april 8 , 2008 have been entered in the list of shareholders kept by the finnish central securities depository ltd. .	1
 our strategic cooperation with rentakran brings us new customers and already-working relationships with the authorities of the new territories , said jarmo laasanen , a senior manager at cramo .	2
mobile phone sales rose 25 % to 5.87 billion euros , while enterprise solution sales dropped 39 % to 186 million euros .	2
sysopen digia plc , press release , 7 february 2006 ibm finland has rewarded its most distinguished partner companies for 2005 .	2
basware invoice processing , basware contract matching , basware order matching and basware kpi reporting tool are part of the basware s enterprise purchase to pay solution suite .	1
the 718,430 new series a shares will become subject to trading on the helsinki stock exchange s main list , together with the old series a shares , on july 3 , 2006 .	1
certain shareholders have irrevocably agreed to vote in favor of the bond issue .	2
finnish construction company yit is reducing the number of start-ups of market-financed residential units in 2007 to about 2,300 from the previously announced 2,700 .	0
operating profit decreased to eur 16mn from eur 21.1 mn in 2008 .	0
in sweden , there is an oversupply of pharmacies .	0
finnish business software group affectogenimap oyj said it had signed an agreement to acquire all the shares in swedish sector company intellibis ab for 12 mln euro $ 15.8 mln on a debt-free basis .	2
however , the production is almost entirely very labor intensive and based on small investments only .	1
according to its notice , skandinaviska enskilda banken ab publ helsinki branch has on 10 august 2009 divested in total 11,958,000 alma media shares to ilkka-yhtyma oyj and kaleva kustannus oy , as the conditions of the agreement made by the companies on 1 july 2009 fulfilled .	1
by cutting the number of plants , the group will trim fixed costs .	2
there did not seem to be enough hours in a day for pekkarinen .	1
fortum is looking to invest in several new production units , including a new waste-fired unit at its brista combined heat and power chp plant and a biofuels-based production unit at vartan chp plant .	1
helsinki afx - kci konecranes said it has raised its stake in mmh holdings inc , the owner of us-based morris materials handling , to 90.9 pct from 74.5 pct .	2
abb deutsche bank upgraded its recommendation on swiss-swedish engineering group abb ltd. to buy from hold .	2
the aim is to increase sales by at least one fifth in 2006 .	2
finnish component supplier componenta corporation omx helsinki : cth1v reported on tuesday 15 july an operating profit of eur46 .2 m on net sales of eur386 .0 m for the financial period january-june 2008 .	1
telecomworldwire-7 april 2006-tj group plc sells stake in morning digital design oy finnish it company tj group plc said on friday 7 april that it had signed an agreement on selling its shares of morning digital design oy to edita oyj .	2
the board of directors has proposed the extraordinary general meeting to authorise the board to decide on the issuance of a maximum of 30mn new shares in one or more share issues .	1
finnish geosentric , a developer and provider of solutions , products , and technologies for location based services , has preliminary agreed on a eur 6mn short-term funding with its leading investor .	2
