text	labels
its total annual revenue comes up to about 160 mln zloty $ 56.9 mln-42 .3 mln euro .	1
the repurchases shall decrease the distributable capital and reserves .	0
jacobs has been supporting storengy s investment of developing storage sites since 2006 as owner s engineer .	1
get midnighttrader in realtime : this report is delayed .	1
liora s got a brand-new bag .	1
body the credit falls due february 24 , 2014 .	1
finnish scanfil , a systems supplier and contract manufacturer to the communications sector and the electronics industry , reports net sales of eur 49.6 mn in the first quarter of 2009 , which are only a per cent smaller than in the corresponding period in 2008 .	0
ruukki s order book at the end of 2010 was 30 % up year-on-year and 10 % up quarter-on-quarter .	2
clothing retail chain sepp nl n s sales increased by 8 % to eur 155.2 mn , and operating profit rose to eur 31.1 mn from eur 17.1 mn in 2004 .	2
it is the most awkward thing to use if you re holding the phone with one hand .	0
its main business area , the glass machinery group of glaston technologies , is the global market leader in glass processing machines .	2
the total headcount reduction will be 50 persons , the company said .	0
insurer axa par : cs slid by 5.35 % to eur 14.15 , after citigroup and ing slashed their targets on the stock .	0
singapore in may 2011 1 july 2010 - finnish air carrier finnair oyj hel : fia1s said today it will open a daily route to singapore on 30 may 2011 as part of its growth strategy in asia .	2
the deal includes an option for cramo to buy out the minority stake in 2011 .	1
operating profit for the six-month period decreased from eur21m , while net sales increased from eur436 .9 m , as compared to the corresponding period in 2007 .	0
upm said the move will lower net profit by x20ac 385 million us$ 520 million in the second quarter , mainly due to impairment charges .	0
the first four of the new shop-in-shops will be opened this spring : on madison avenue in new york as well as in chicago , los angeles and san francisco .	1
when open next year , it will be the largest facility in the world to produce diesel fuel from renewable feedstock such as palm oil and animal fat .	2
our solutions are fully arabized , and our message is that we want to become the it partner of choice for businesses in the near-east region .	1
tietoenator itself uses nokia s intellisync mobile suite s wireless email , calendar , and device management capabilities , and the company will now extend these services to its customers .	2
the circuit s overall production rate on a weekly basis is now in excess of an average of 40,000 tonnes per day , with volumes in excess of 50,000 tonnes per day being reached on individual days .	2
the highest growth would be in china , while weakening demand would continue in north america , upm said .	1
forestries were also higher , driven by yesterday s bullish analyst comment on stora enso in dagens industri , dealers said .	2
the owners who have participated in the business operations of the company will continue in poyry s employment after the transaction .	1
overall , 50 percent of respondents were confident about their security when banking online .	2
nokian tyres tyres are considered genuine winter tyres in russia .	1
rinkuskiai raised the sales by 18.1 percent , to 1.37 million liters , while the sales of kauno alus grew by 14.3 percent , to 960,000 liters .	2
rautakesko s business operations in norway and russia , acquired in july 2005 , are included in the figures of the comparable period , impacting sales growth starting from august .	1
operating result , excluding one-off items , totaled eur 9.1 mn compared to eur 10.6 mn in continuing operations , excluding one-off items in 2004 .	0
only the driver was left in the car with the suspect , who was kidnapped and forced at gunpoint to drive to durham .	0
the company will use the assets for strengthening its balance sheet and financial position .	2
after buying eukor car carriers 50 percent stake , grimaldi group is now the sole owner of the swedish roll-on , roll-off port of wallhamn .	1
in 2009 , it reported net sales of approximately eur 6mn .	1
on january 29 , 2009 the largest nordic bank nordea and finnish retail chain stockmann launched a regionally unique cooperation project : they are the first to introduce a common mastercard credit card enabling payments in different states and stores .	1
paper stocks were among the biggest fallers , with stora enso down 2.30 pct to 14.01 eur , m-real down 2.86 pct to 5.09 eur and upm-kymmene 1.14 pct lower at 19.10 eur .	0
the program included operational improvements and reductions in personnel , mainly in the netherlands .	1
all the ferries had run into trouble just outside the stockholm archipelago , made up of more than 20,000 islands .	0
the offer represents a premium of 24 % over the stock s closing price on friday .	2
the company has committed to further expanding the apollo portfolio .	2
pohjola and cooperative banks have continued to combine their branch office network .	1
no blind-spots coming from 1 vantage point allows investigators to see the whole story in high resolution with no unbroken video .	1
we are pleased to invite you to join m-real s international conference call at 3:00 p.m. eet .	1
several large stocks tacked lower , however .	0
according to the ceo of nordea bank estonia vahur kraft , nordea finland and stockmann have been cooperating for more than ten years .	2
jul. 18 -- police are looking for a man who they say terrorized three males at gunpoint on east maple avenue this afternoon , shooting one of them and kidnapping another .	0
nokia s u.s. shares were 3.3 percent lower at $ 12.73 by 1750 gmt .	0
juha jordan , chief engineer at glaston , said one of the reasons for choosing vacon as a global ac drives supplier is that it has service and support centres in the same countries where glaston operates .	2
the competition was received with great enthusiasm by the employees , he goes on .	2
 operating profit declined mainly due to the increased cost of wood and recycled fiber and the strengthened euro . 	0
 this is a win for all oems targeting to develop wimax products .	2
in september 2010 , the finnish group agreed to buy danish company rose poultry a-s for up to eur23 .9 m in a combination of cash and stock .	2
shock phase , consumers have once again started to plan and implement building projects .	1
new delhi , feb. 12 -- korteniemi anneli , helokunnas tuija , peltola marjo , keskinen jukka , salminen jussi , tusa kia and janhonen risto of nokia telecommunications oy , espoo , finland have developed cable adjustment device .	1
the group brand portfolio includes the leading brand in the industry , rapala , and other global brands like vmc , storm , blue fox , luhr jensen , williamson , marttiini and sufix .	1
 our decision and resolve on meego is only stronger , she continued .	2
it is estonia s second-largest meat processing company by market share according to ac nielsen s 2008 data , 13 percent .	1
the other actions include the cutting of the expensive weekend shifts , the freezing of the production bonus system and by a general cost-cutting program .	1
the company said that 80 % of the shares of the holding company will be sold to meadville holdings limited , a hong kong listed parent company of the meadville group .	1
the size of the extension , 18.5 % of which already has been let , will have a gross area of about 2,830 sq m 30,460 sq ft .	1
following the transaction , lundbeck has worldwide rights for nalmefene , excluding north america , mexico , turkey and south-korea .	2
the company also said that its board of directors has proposed a profit distribution of eur0 .92 per share .	1
paper companies were in negative territories , with stora enso r shedding 1.62 pct to 12.73 eur , upm-kymmene down 0.80 pct at 18.64 eur and m-real b 0.18 pct lower at 5.57 eur .	0
india is high on our priority since business links between our two countries is also expanding , tornstrom said .	1
it services firm tietoenator was bucking the general trend , holding flat at 22.70 eur , after slipping back from earlier gains .	0
 we ve been feeling quite positive about the region as a whole .	2
it has sold one half of its business operations and will enter the helsinki stock exchange via the back door through an innovative buyout arrangement with kasola .	1
this new deal has strengthened the partnership from telemig celular and tecnomen , which it has started since the beginning of telemig s prepaid operations .	2
the indexes include the top companies that are committed to sustainable development .	1
finnish newspaper publisher sanoma , of media group sanomawsoy , is merging its free sheets uutislehti 100 and metro as of mid-september 2008 to form a new free sheet to be named metro .	1
deliveries will start in the second half of 2007 and the start-up of the mill is scheduled for 2008 .	1
later on , about 150 finnish-made houses will be build in the area .	1
swedbank hypotek - is to issue a benchmark , fixed rate covered deal in euros , maturing january 2010 .	1
the facility consists of a seven year bullet term loan of 200 mln euro $ 292.4 mln and a 150 mln euro $ 219.3 mln five year revolving credit facility .	1
arcelormittal chief executive officer lakshmi mittal has already cut output at some furnaces .	0
the payment of 2.779 million litas in interest on a long-term loan provided by ragutis majority shareholder , estonia s a. le coq , also added to the losses .	0
chic and cheerful , finnish design house marimekko has been sending its geometric textiles out into the world for the past 60 years .	1
these companies will be able to keep their market positions .	2
according to tyrv ninen s estimation , japan is a very essential location in terms of finnair s asian strategy .	1
the organization that is a member of the russian auto sector union mpra has become active since tikkurila acquired russian paint company kraski teks in 2006 .	1
following the divestment , fiskars s outdoor unit will comprise the brands gerber , silva and buster , and will focus on multi-tools , knives , compasses , mobile lighting , pedometers , and aluminium boats .	1
the estimated turnover of the new company is lvl 2,5 million eek 40 million .	1
microsoft also churned up its courtship , agreeing to use the navteq mapping service , which is offered by a company nokia bought for $ 8.1 billion a few years ago .	2
to achieve synergy targets related to the acquisition , vaisala is consolidating its manufacturing , depot and data services , and finance activities currently located in uniontown , pennsylvania , st. louis , missouri and durham , north carolina .	1
nokia s share price fell less than one percent to 18.70 euros $ 25.41 in helsinki , while siemens shares fell 1.02 percent to 90.19 euros $ 122.57 in frankfurt .	0
alexandria , va. , oct. 3 -- markka a. oksanen and harald kaaja , both of helsinki , finland , juha salokannel of kangasala , finland , and arto palin of viiala , finland , have developed a system for providing communications security .	1
the use of validation rule base enables verifying that processing rule bases managed by different administrators fulfil some set requirements .	1
 our customers now have the chance to make bookings for all the services they want at one location , said mikko tuomainen , in-charge of finnair s internet sales .	2
the board further said the company omitted to tender for a substantial part of the works and as such they had rightfully been found non-responsive by the evaluation team .	1
the share sale , to foreign and finnish investors , is expected to raise some euro300 million us$ 380 million .	1
the sale of the food potato business is part of raisio s plan to streamline and clarify its business operations .	1
finnish real estate company sponda oyj said on april 11 , 2008 it would build vuosaari harbour service center at the port of helsinki .	1
it expects revenue between $ 8.4 billion and $ 8.7 billion , compared to analyst estimates of $ 8.67 billion .	1
measures will be launched immediately and are due to be finalized in the first quarter of 2010 .	1
it is in line with its plans to focus on selected growth segments and streamline corporate structure .	2
finnish paper maker upm-kymmene corp. on monday announced the sale of its wrapping unit walki wisa to the capman investment group in a move to further concentrate on its core business .	1
the category was marked by maturity and the recession .	1
the end-to-end delivery combines the competencies and services from tietoenators telecom media , processing network and digital innovations business areas .	1
the orders are part of a long-term development plan of latvijas finieris .	1
aspo serves demanding business-to-business customers .	1
poyry is a global expert in consulting and engineering .	1
the largest construction company in finland , yit corporation , is to acquire 70 % of the shares in the slovak construction company reding bratislava .	1
in contrast , the company s net loss for the third quarter of 2009 contracted to eur 76 million from eur 256 million for the corresponding period a year ago .	2
according to finnish insurance companies tapiola , local insurance group l nhivakuutus , and pohjola the two fierce storms at the end of july and in the beginning of august 2010 that felled trees around finland have speeded up sales of forest insurance .	2
the oil shale feeder-supply solution will deliver crushed oil shale to the shale oil refinery already in operation as well as to the novel enefit-280 shale oil technology processing plant .	1
the company also said that the deployment of the danish 4g network continues and it expects to cover 75 % of the danish population in 2011 .	1
- the group s sales during the period were eur 37.5 million eur 48.2 million , 1-9 2008 and result before taxes was a loss of eur -3.5 1.2 million .	0
solvay s.a. has engaged poyry to provide project management , engineering , procurement , and site services for a hydrogen peroxide production plant to be built by a solvay-basf joint venture at basf s zandvliet site , belgium .	1
finnish exel composites , a technology company that designs , manufactures , and markets composite profiles and tubes for various industrial applications , reports its net sales decreased by 0.6 % in the second quarter of 2010 to eur 19.2 mn from eur 19.3 mn in the corresponding period in 2009 .	0
for telenor , the three and a half year contract is worth an estimated 12.6 m. yit has chosen telenor and elisa as its principal suppliers of ict solutions in norway , sweden , denmark and finland .	2
a few months ago , teva vice chairman phillip frost and marathon venture capital fund tase : mara sold protalix shares .	1
the proportion of estonian and lithuanian passengers on the tallinn-helsinki route also grew in july .	2
loudeye corp. , up $ 2.56 at $ 4.33 nokia corp. , down 10 cents at $ 19.46 nokia agreed to buy the digital music distributor for $ 60 million .	1
nokia - the world s largest mobile phone manufacturer - and china postel - china s largest mobile phone distributor - have a long-standing partnership that continues to grow stronger over time .	2
mobile data transfer is expected to increase explosively in the lte era .	1
the parties have also agreed that l nnnen tehtaat has the right to sell the remaining shares in suomen rehu to hankkija-maatalous 15 months after the purchase of the majority holding , at the earliest .	1
it delivers a different user experience and enables us to widen the market we can address . 	2
a tinyurl link takes users to a scamming site promising that users can earn thousands of dollars by becoming a google nasdaq : goog cash advertiser .	0
for the full 2010 the company expects its net sales and operating result to improve from the previous year , saying that a positive operating result and its amount will depend on the order intake by the end of the summer .	2
to prove the efficiency of the china mobile system , rod baber , an english climber , climbed to the mount everest summit and successfully made calls .	2
also , cba is to issue a benchmark , 10 year fixed rate deal in euros .	1
honka s subsidiaries in france and germany will also benefit by , for example , arranging customer events in conjunction with world cup skiing competitions .	1
the through service of fesco is a telling example of strengthening the relationship between logistics companies and operators at the international level .	2
southfield , mich. -- central corporate credit union will again distribute patronage dividends to members by waiving all service fees incurred during the months of july and november 2008 , to the tune of an estimated $ 1 million .	2
the operating margin came down to 2.4 % from 5.7 % .	0
 people who enjoy mobile games are often the same customers who enjoy experimenting with new mobile services and content .	1
the employer , together with health personnel , supports quitting and pays part of the cost of nicotine treatments .	1
no financial details were reported .	1
at 1.33 pm , the omx helsinki 25 was 0.30 pct lower at 2,463.67 and the omx helsinki was down 0.37 pct at 8,537.42 on volume of 256 mln eur .	0
operating profit for the 12-month period decreased from eur17 .9 m while net sales increased from eur58 .3 m , as compared to 2007 .	0
the duration of the lay-offs per employee will vary from one to six weeks .	1
last year , lemminkainen completed the kouvola k-supermarket contract .	2
kemira will supply the additional volumes of iron coagulants from the company s plant at helsingborg , sweden .	1
rosen was cautious about being too optimistic inregard to the second half of the year .	1
the merger between the two telecoms operators was expected to result in the world s fourth largest telecoms operator .	1
back then , tikkurila s former owner , finnish chemicals company kemira oyj hel : kra1v , distributed an 86 % stake to kemira shareholders to facilitate the divestment and listing of tikkurila .	1
the company , which celebrates its fiftieth anniversary next year , has been exporting distinctive detached homes to central europe for several decades .	2
earnings per share for january-june 2010 were eur0 .30 , an increase of 20 % year-on-year eur0 .25 .	2
in finland , martela offers a comprehensive service that can cover the entire process of change from initial inventory and design to removal and maintenance .	1
in january-august 2009 , imports by sea in container , lorry , and trailer units fell by 27.7 % and exports by 28.6 % from the corresponding period in 2008 .	0
excluding non-recurring items , pre-tax profit surged 45 % to eur80m .	2
the buyer aims to thus reinforce its position in denmark , martela group managing director heikki martela said .	2
the contracts of the employees , 96 of whom are blue-collar workers , will be ended between march and august 2011 .	0
the recent troubles simply make neteller cheaper .	0
with the measures , suominen corporation aims to ensure the competitiveness of the flexible packaging business in the long term .	2
 neste oil has responded to the challenge posed by the european union s target of biofuels accounting for 5.8 % of traffic fuel usage in the eu by 2010 by developing its nexbtl technology for producing diesel fuel from renewables , the federation said .	2
swiss bank credit suisse international will act as an investor in the locomotive manufacturing plant , the astana administration said .	1
 the second quarter of 2010 was the firstquarter with growth in net sales since the third quarter of2008 , said magnus rosen , ramirent ceo .	2
net sales of finnish sanoma learning literature , of finnish media group sanoma , decreased by 3.6 % in january-june 2009 totalling eur 162.8 mn , down from eur 168.8 mn in the corresponding period in 2008 .	0
30 november 2009 - finnish office furniture maker martela oyj hel : maras said today that it will make redundant three people and other nine will be laid off permanently from the company s office staff and factory workers .	0
the company intends to raise production capacity in 2006 .	2
the recruits who have completed the k-retailer trainee program are qualified to start a career as independent retailers in k-stores .	1
the value of orders on hand totaled eur 237.1 mn .	1
vacon controls a further 5 % of the company via investment fund power fund i. eur 1.0 usd 1.397	1
thus the group s balance sheet will have about eur25 .8 m of goodwill , the company added .	1
 these tests are part of a larger campaign which includes various customer trials and demonstrations to make lte on 800 mhz commercially viable by this summer , nokia siemens head of lte business line , reino tammela , said .	1
travel expenses would be reimbursed in accordance with the travel policy of the company .	1
earnings per share eps in the first quarter amounted to a loss of eur0 .20 .	1
crucially , the decision to use etsi european telecommunication standard institute - backed dvb-h adds to the growing list of operators and equipment manufacturers opting for the standard see global : 20 january 2006 : competing technologies vie for mobile tv .	1
helsinki afx - outokumpu technology said it has signed a 3.5 mln eur agreement with mongolia s erdenet mining corporation for the engineering of the first hydrocopper plant to be built at the erdenet mine site .	2
the paper industry s de-inking sludge , which is produced in mills that use recycled fiber when printing ink is removed from recovered paper , is also a suitable raw material .	1
 every partner will be allowed to buy a quantity of electricity corresponding to their share in the consortium , at production cost , a letter of intent said .	1
target company : tieto corporation , business identity code : 0101138-5 date of change in holding : 22 january 2010 portion of the shares and votes : the current group holding of op-pohjola group central cooperative opk is 2982 587 shares , which represents 4.14 % of the shares and voting rights .	1
the deliveries started in april 2006 and will be completed in 2007 .	1
finnish p ayry has been awarded an engineering contract by cfr , the national railway company of romania .	2
teollisuuden voima oyj , the finnish utility known as tvo , said it shortlisted mitsubishi heavy s eu-apwr model along with reactors from areva , toshiba corp. , ge hitachi nuclear energy and korea hydro nuclear power co. .	1
according to ultrascan , with a software acquired from crackers , it has managed to change the mobile phone in a way that the phone was able to get hold of a one-time password sent by a bank via a text message .	1
the deal is in line with etteplan s strategy to operate as a partner of global customers and provide industrial technology design services .	1
raisio s malting capacity was in full use in 2008 .	2
eb will hold the exclusive rights to market the new entity s product .	1
 we love activision s fresh , colorful approach to rapala : we fish , said kelly brockpahler , rapala .	2
upm is the biggest producer of magazine paper in europe , with a market share of over 30 pct , and it is likely to say that prices in the segment were at best flat during the quarter , analysts said .	1
the value of the deal is estimated at between sek25m and sek50m .	1
- among other finnish shares traded in the us , stora enso closed 0.33 pct lower at 12.11 eur , upm-kymmene was up 0.28 pct at 18.10 eur , and metso was down 0.13 pct at 31.06 eur .	1
finnish food industry companies hk ruokatalo and atria will form a joint venture company called l nnsi-kalkkuna to produce turkey meat .	2
aldata noted that its voice supply chain technology approach enables vdw to integrate with warehouse management systems .	1
acquisitions have been made and businesses have been well integrated .	2
the tekla structures product box , if needed , is now made from recycled material .	1
as a result , it has started negotiations with the banks on provisional amendments concerning the covenants and other credit terms .	1
according to finnish pension insurance company varma , varma was the recipient of over two thirds of the revenue of the earnings-related pension cover that was under competitive tendering in finland .	2
based upon its unique fiber expertise and innovative approach , the company has a strong market position in several business areas in which it operates .	2
pretax loss totaled eur 1.2 mn , down from a profit of eur 2.1 mn in 2004 .	0
the engines in asia-pacific industry profile is an essential resource for top-level data and analysis covering the engines industry .	1
"fiskars , the world s 1 scissors brand tm , recently won learning -"" magazine s 2011 teachers choice award for the classroom ."	2
f-secure online backup automatically protects all the content stored on a computer or smartphone by making a copy of the content to an online location .	1
under finnish law , parliament grants licences to build nuclear power plants .	1
talvik says the relocation of application programs on servers will continue , while hp servers were approved because of hp supplying a tailor-made solution to elisa .	1
beef imports fell slightly from 2006 , to 14mn kilos .	1
sales in finland rose by 3.9 % and international growth was 0.7 % .	2
 eb tough voip was designed to fulfill the communications needs of military units , and we continue to strive towards achieving that goal , mikko viitaniemi , eb elektrobit defense products , wireless solutions senior manager , said in a statement .	1
eb announced in its stock exchange release on november 18th 2008 that j.t. bergqvist has resigned from the chairmanship and membership of the board of eb .	0
alexandria , va. , dec. 19 -- united states patent no. 7,853,620 , issued on dec. 14 , was assigned to nokia corp. espoo , finland .	1
